{
  "$schema": "http://json-schema.org/draft-07/schema#",
  "$id": "https://aisystant.system-school.ru/schemas/homework-checker/check_request.json",
  "title": "CheckRequest v0.1",
  "description": "Пакет запроса на проверку ДЗ от LMS к ДЗ-чекеру (v0.1 — без идентификаторов)",
  "type": "object",
  "required": ["answer_text", "question_text", "course_name", "section_name"],
  "properties": {
    "answer_text": {
      "type": "string",
      "minLength": 1,
      "description": "Текст ответа студента"
    },
    "question_text": {
      "type": "string",
      "minLength": 1,
      "description": "Текст вопроса/пункта чеклиста"
    },
    "course_name": {
      "type": "string",
      "minLength": 1,
      "description": "Название курса (текстовое, без идентификаторов и номеров версий)"
    },
    "section_name": {
      "type": "string",
      "minLength": 1,
      "description": "Название раздела из дерева навигации (текстовое, без идентификаторов)"
    }
  },
  "additionalProperties": false
}
