{
  "answer_text": "Любая модель части физического мира фокусируется на одних свойствах и опускает другие свойства. Именно поэтому описаний может быть несколько. Например, у программного продукта может быть продающая презентация, может быть архитектурная схема, могут быть метрики в системе мониторинга. Все они описывают один и тот же программный продукт, но фокусируются на разных аспектах.",
  "question_text": "Почему физический мир может иметь множество описаний? Приведите пример разных описаний какой-либо части физического мира (объекта, системы). Например, из рабочего проекта или из квартиры.",
  "course_name": "Системное мышление",
  "section_name": "Физический мир и ментальное пространство"
}
